[32m[I 2022-03-30 07:59:04,455][0m Trial 86 finished with value: 0.9697441353134623 and parameters: {'reg_alpha': 8.635013664050486, 'reg_lambda': 5.323078707388316, 'subsample': 0.8680998881231854, 'colsample_bytree': 0.8282912613796003, 'max_depth': 12, 'min_child_weight': 3, 'learning_rate': 0.34143622349581615, 'gamma': 1.08151634502386, 'grow_policy': 'depthwise', 'max_delta_step': 8.40874520169478, 'scale_pos_weight': 8.97673478456874}. Best is trial 67 with value: 0.9727260951053012.[0m
[32m[I 2022-03-30 08:02:47,294][0m Trial 87 finished with value: 0.9715151173040687 and parameters: {'reg_alpha': 9.282684049010264, 'reg_lambda': 1.5922666188274728, 'subsample': 0.8649956422355107, 'colsample_bytree': 0.878186229591574, 'max_depth': 13, 'min_child_weight': 12, 'learning_rate': 0.21230243630986573, 'gamma': 0.717592774273736, 'grow_policy': 'lossguide', 'max_delta_step': 9.247124251454071, 'scale_pos_weight': 9.723720245557086}. Best is trial 67 with value: 0.9727260951053012.[0m
[32m[I 2022-03-30 08:08:08,037][0m Trial 88 finished with value: 0.9711920729457842 and parameters: {'reg_alpha': 8.786879977578986, 'reg_lambda': 3.4827116938121754, 'subsample': 0.7957752142706949, 'colsample_bytree': 0.8898472554472747, 'max_depth': 12, 'min_child_weight': 10, 'learning_rate': 0.03493646796512523, 'gamma': 2.591859801282607, 'grow_policy': 'lossguide', 'max_delta_step': 8.670281543357909, 'scale_pos_weight': 3.1672851812578555}. Best is trial 67 with value: 0.9727260951053012.[0m
[32m[I 2022-03-30 08:11:17,277][0m Trial 89 finished with value: 0.9694903201833148 and parameters: {'reg_alpha': 6.363095342252434, 'reg_lambda': 4.208993009695756, 'subsample': 0.9479964086290578, 'colsample_bytree': 0.771044955273821, 'max_depth': 6, 'min_child_weight': 11, 'learning_rate': 0.23539169781588348, 'gamma': 2.101682376185413, 'grow_policy': 'lossguide', 'max_delta_step': 9.089452427570395, 'scale_pos_weight': 1.749783020713692}. Best is trial 67 with value: 0.9727260951053012.[0m
[32m[I 2022-03-30 08:15:20,692][0m Trial 90 finished with value: 0.9579757700040995 and parameters: {'reg_alpha': 6.343955500976459, 'reg_lambda': 1.1532920992041307, 'subsample': 0.9655854794135301, 'colsample_bytree': 0.7463310611476696, 'max_depth': 7, 'min_child_weight': 14, 'learning_rate': 0.007924007720943899, 'gamma': 0.8503268979629962, 'grow_policy': 'lossguide', 'max_delta_step': 9.047314287043822, 'scale_pos_weight': 7.5959260766769585}. Best is trial 67 with value: 0.9727260951053012.[0m
[32m[I 2022-03-30 08:19:03,637][0m Trial 91 finished with value: 0.9712326721161898 and parameters: {'reg_alpha': 8.842066722722508, 'reg_lambda': 1.0239560330862831, 'subsample': 0.8032906275747858, 'colsample_bytree': 0.7233894933127711, 'max_depth': 13, 'min_child_weight': 45, 'learning_rate': 0.10646996715468751, 'gamma': 4.058280546086152, 'grow_policy': 'lossguide', 'max_delta_step': 9.983272818574864, 'scale_pos_weight': 14.271369634615603}. Best is trial 67 with value: 0.9727260951053012.[0m
[32m[I 2022-03-30 08:23:12,704][0m Trial 92 finished with value: 0.9721874528355986 and parameters: {'reg_alpha': 9.61055586601834, 'reg_lambda': 2.6539881220613024, 'subsample': 0.7217006947787976, 'colsample_bytree': 0.8621584997132578, 'max_depth': 13, 'min_child_weight': 24, 'learning_rate': 0.059998188118974116, 'gamma': 0.8133797523440939, 'grow_policy': 'lossguide', 'max_delta_step': 9.064622918906993, 'scale_pos_weight': 10.701705240599606}. Best is trial 67 with value: 0.9727260951053012.[0m
[32m[I 2022-03-30 08:25:37,675][0m Trial 93 finished with value: 0.9708431831522687 and parameters: {'reg_alpha': 9.131493185970726, 'reg_lambda': 1.4311205046692106, 'subsample': 0.6084804488296935, 'colsample_bytree': 0.4529431417256842, 'max_depth': 13, 'min_child_weight': 15, 'learning_rate': 0.15783796783746412, 'gamma': 0.8797880630637325, 'grow_policy': 'lossguide', 'max_delta_step': 8.656864444384778, 'scale_pos_weight': 10.616906196758277}. Best is trial 67 with value: 0.9727260951053012.[0m
[32m[I 2022-03-30 08:29:08,247][0m Trial 94 finished with value: 0.9717027031260667 and parameters: {'reg_alpha': 9.037168853086781, 'reg_lambda': 4.581814416001686, 'subsample': 0.7155518679469202, 'colsample_bytree': 0.8620724307575187, 'max_depth': 15, 'min_child_weight': 31, 'learning_rate': 0.11610185054577167, 'gamma': 1.2215602403598602, 'grow_policy': 'lossguide', 'max_delta_step': 8.207609790907624, 'scale_pos_weight': 9.567813619665692}. Best is trial 67 with value: 0.9727260951053012.[0m
[32m[I 2022-03-30 08:33:31,951][0m Trial 95 finished with value: 0.9710885566138904 and parameters: {'reg_alpha': 6.304698753760231, 'reg_lambda': 6.567214698944717, 'subsample': 0.9564724973314527, 'colsample_bytree': 0.6263133947332838, 'max_depth': 13, 'min_child_weight': 22, 'learning_rate': 0.13136455024136523, 'gamma': 3.393989720908308, 'grow_policy': 'lossguide', 'max_delta_step': 9.734479009565417, 'scale_pos_weight': 6.480680192599699}. Best is trial 67 with value: 0.9727260951053012.[0m
[32m[I 2022-03-30 08:37:49,461][0m Trial 96 finished with value: 0.9694970673413289 and parameters: {'reg_alpha': 9.291577865060951, 'reg_lambda': 5.084217598423264, 'subsample': 0.6573878833634277, 'colsample_bytree': 0.9438954657416142, 'max_depth': 15, 'min_child_weight': 33, 'learning_rate': 0.24422928768017715, 'gamma': 5.38987325139151, 'grow_policy': 'lossguide', 'max_delta_step': 9.57906994268824, 'scale_pos_weight': 12.129610620848835}. Best is trial 67 with value: 0.9727260951053012.[0m
[32m[I 2022-03-30 08:43:29,883][0m Trial 97 finished with value: 0.9724744291131642 and parameters: {'reg_alpha': 9.741666782609888, 'reg_lambda': 7.761936130058608, 'subsample': 0.8774673439009443, 'colsample_bytree': 0.8749646609424566, 'max_depth': 11, 'min_child_weight': 2, 'learning_rate': 0.03963373869285994, 'gamma': 1.09027030880998, 'grow_policy': 'lossguide', 'max_delta_step': 8.543968383534862, 'scale_pos_weight': 12.907880284517525}. Best is trial 67 with value: 0.9727260951053012.[0m
[32m[I 2022-03-30 08:47:55,823][0m Trial 98 finished with value: 0.9728386524147771 and parameters: {'reg_alpha': 7.834668656735599, 'reg_lambda': 9.92438998860236, 'subsample': 0.8489954388436329, 'colsample_bytree': 0.8508454868991611, 'max_depth': 12, 'min_child_weight': 6, 'learning_rate': 0.1186142450607101, 'gamma': 0.02922983279581448, 'grow_policy': 'lossguide', 'max_delta_step': 9.698027660915235, 'scale_pos_weight': 15.083492367393609}. Best is trial 98 with value: 0.9728386524147771.[0m
[32m[I 2022-03-30 08:52:52,841][0m Trial 99 finished with value: 0.9719890071909213 and parameters: {'reg_alpha': 8.896812827420606, 'reg_lambda': 9.479260566431652, 'subsample': 0.7568019157155986, 'colsample_bytree': 0.7332426006691896, 'max_depth': 14, 'min_child_weight': 17, 'learning_rate': 0.03287492151816482, 'gamma': 2.814378324103827, 'grow_policy': 'lossguide', 'max_delta_step': 8.179162681738475, 'scale_pos_weight': 17.739479459957117}. Best is trial 98 with value: 0.9728386524147771.[0m
[32m[I 2022-03-30 08:57:25,323][0m Trial 100 finished with value: 0.9727166299861657 and parameters: {'reg_alpha': 8.669288712795304, 'reg_lambda': 8.912997590456122, 'subsample': 0.7415734586469453, 'colsample_bytree': 0.8735512948995674, 'max_depth': 14, 'min_child_weight': 15, 'learning_rate': 0.06058608191759955, 'gamma': 0.42609144039462876, 'grow_policy': 'lossguide', 'max_delta_step': 7.683975689487186, 'scale_pos_weight': 19.99947149704554}. Best is trial 98 with value: 0.9728386524147771.[0m
[32m[I 2022-03-30 09:01:57,621][0m Trial 101 finished with value: 0.9722562057427625 and parameters: {'reg_alpha': 8.523034395593049, 'reg_lambda': 9.591366794826389, 'subsample': 0.5082672365882179, 'colsample_bytree': 0.9356647936824235, 'max_depth': 12, 'min_child_weight': 11, 'learning_rate': 0.09614963326117101, 'gamma': 0.567074159029614, 'grow_policy': 'lossguide', 'max_delta_step': 7.289473100282226, 'scale_pos_weight': 17.46435033847672}. Best is trial 98 with value: 0.9728386524147771.[0m
[32m[I 2022-03-30 09:05:12,877][0m Trial 102 finished with value: 0.9686039726402668 and parameters: {'reg_alpha': 6.459585741938991, 'reg_lambda': 9.740465063676794, 'subsample': 0.6602055371640727, 'colsample_bytree': 0.952042979210579, 'max_depth': 14, 'min_child_weight': 28, 'learning_rate': 0.39209679876130654, 'gamma': 0.4960330222259965, 'grow_policy': 'lossguide', 'max_delta_step': 9.903631465712438, 'scale_pos_weight': 13.421092150673548}. Best is trial 98 with value: 0.9728386524147771.[0m
[32m[I 2022-03-30 09:07:49,739][0m Trial 103 finished with value: 0.9676037817865767 and parameters: {'reg_alpha': 7.960484805171097, 'reg_lambda': 9.170863260197663, 'subsample': 0.34517574686069347, 'colsample_bytree': 0.8830886002733731, 'max_depth': 15, 'min_child_weight': 31, 'learning_rate': 0.18139757786410188, 'gamma': 1.0007691950029334, 'grow_policy': 'depthwise', 'max_delta_step': 7.20936386196091, 'scale_pos_weight': 12.078532281970581}. Best is trial 98 with value: 0.9728386524147771.[0m
[32m[I 2022-03-30 09:12:28,728][0m Trial 104 finished with value: 0.971938927414041 and parameters: {'reg_alpha': 9.645345264977369, 'reg_lambda': 8.283763546863128, 'subsample': 0.9582240811338629, 'colsample_bytree': 0.7742773280848484, 'max_depth': 9, 'min_child_weight': 12, 'learning_rate': 0.042354597796184626, 'gamma': 1.263785589337673, 'grow_policy': 'lossguide', 'max_delta_step': 7.913209086515552, 'scale_pos_weight': 10.56528458011567}. Best is trial 98 with value: 0.9728386524147771.[0m
[32m[I 2022-03-30 09:16:44,786][0m Trial 105 finished with value: 0.9721082374101404 and parameters: {'reg_alpha': 7.945984515141129, 'reg_lambda': 9.86377481409703, 'subsample': 0.45163284551536664, 'colsample_bytree': 0.9479950442292873, 'max_depth': 8, 'min_child_weight': 2, 'learning_rate': 0.08676086746453356, 'gamma': 0.4878139913637879, 'grow_policy': 'lossguide', 'max_delta_step': 7.271806056108521, 'scale_pos_weight': 17.7088680590999}. Best is trial 98 with value: 0.9728386524147771.[0m
[32m[I 2022-03-30 09:19:09,708][0m Trial 106 finished with value: 0.9626901540357337 and parameters: {'reg_alpha': 8.62394912809285, 'reg_lambda': 8.11378223826877, 'subsample': 0.13853068407528019, 'colsample_bytree': 0.9565901920034549, 'max_depth': 14, 'min_child_weight': 16, 'learning_rate': 0.14044324491891436, 'gamma': 4.323615482809669, 'grow_policy': 'lossguide', 'max_delta_step': 7.924052284074435, 'scale_pos_weight': 19.41837699007503}. Best is trial 98 with value: 0.9728386524147771.[0m
[32m[I 2022-03-30 09:23:34,340][0m Trial 107 finished with value: 0.9722919569599143 and parameters: {'reg_alpha': 9.24142331022148, 'reg_lambda': 4.986065256791997, 'subsample': 0.9373120077851536, 'colsample_bytree': 0.860742868275901, 'max_depth': 12, 'min_child_weight': 4, 'learning_rate': 0.09810681770419519, 'gamma': 0.16429647872022002, 'grow_policy': 'lossguide', 'max_delta_step': 7.360851140616074, 'scale_pos_weight': 6.99491388872637}. Best is trial 98 with value: 0.9728386524147771.[0m
[32m[I 2022-03-30 09:27:58,664][0m Trial 108 finished with value: 0.9707492030912679 and parameters: {'reg_alpha': 9.645678762941495, 'reg_lambda': 4.344950334131611, 'subsample': 0.9333409803817808, 'colsample_bytree': 0.9707276449537376, 'max_depth': 8, 'min_child_weight': 23, 'learning_rate': 0.17034758831826952, 'gamma': 1.3307772646240805, 'grow_policy': 'depthwise', 'max_delta_step': 5.457419453278754, 'scale_pos_weight': 3.6443748206370596}. Best is trial 98 with value: 0.9728386524147771.[0m
[32m[I 2022-03-30 09:32:14,435][0m Trial 109 finished with value: 0.971293121868887 and parameters: {'reg_alpha': 9.750532479214334, 'reg_lambda': 4.749801200288671, 'subsample': 0.715518704863849, 'colsample_bytree': 0.940548131159207, 'max_depth': 9, 'min_child_weight': 45, 'learning_rate': 0.09466097905655797, 'gamma': 0.317539198542483, 'grow_policy': 'lossguide', 'max_delta_step': 9.138630581894539, 'scale_pos_weight': 13.25400704536302}. Best is trial 98 with value: 0.9728386524147771.[0m
[32m[I 2022-03-30 09:35:27,130][0m Trial 110 finished with value: 0.9712762398605223 and parameters: {'reg_alpha': 5.401248933735908, 'reg_lambda': 7.068600875692145, 'subsample': 0.8144098929649781, 'colsample_bytree': 0.7345172081436175, 'max_depth': 12, 'min_child_weight': 4, 'learning_rate': 0.2900249691877998, 'gamma': 0.07017507372707527, 'grow_policy': 'lossguide', 'max_delta_step': 6.193808188681996, 'scale_pos_weight': 17.53305720645653}. Best is trial 98 with value: 0.9728386524147771.[0m
[32m[I 2022-03-30 09:39:19,022][0m Trial 111 finished with value: 0.971386429940325 and parameters: {'reg_alpha': 9.328560318870638, 'reg_lambda': 9.004329122732162, 'subsample': 0.9126371310406158, 'colsample_bytree': 0.9402355786320049, 'max_depth': 12, 'min_child_weight': 6, 'learning_rate': 0.2555256807232898, 'gamma': 0.18633008233904694, 'grow_policy': 'lossguide', 'max_delta_step': 8.457188087136162, 'scale_pos_weight': 17.602818020780372}. Best is trial 98 with value: 0.9728386524147771.[0m
[32m[I 2022-03-30 09:43:35,936][0m Trial 112 finished with value: 0.9722787137519401 and parameters: {'reg_alpha': 7.492711263482638, 'reg_lambda': 8.892056576503023, 'subsample': 0.847468592274109, 'colsample_bytree': 0.8467963522137175, 'max_depth': 15, 'min_child_weight': 31, 'learning_rate': 0.08457727456854616, 'gamma': 0.2556493214850561, 'grow_policy': 'lossguide', 'max_delta_step': 6.877658057071691, 'scale_pos_weight': 19.66933088546281}. Best is trial 98 with value: 0.9728386524147771.[0m
[32m[I 2022-03-30 09:47:30,480][0m Trial 113 finished with value: 0.9707477656703624 and parameters: {'reg_alpha': 7.782808913629588, 'reg_lambda': 6.380305167438188, 'subsample': 0.48080483559888654, 'colsample_bytree': 0.9106335925561225, 'max_depth': 12, 'min_child_weight': 6, 'learning_rate': 0.1844538096124031, 'gamma': 0.39643439765099303, 'grow_policy': 'lossguide', 'max_delta_step': 8.927507266514938, 'scale_pos_weight': 17.01112086226817}. Best is trial 98 with value: 0.9728386524147771.[0m
[32m[I 2022-03-30 09:52:09,987][0m Trial 114 finished with value: 0.9720163484073726 and parameters: {'reg_alpha': 9.970164107488475, 'reg_lambda': 5.267088334427428, 'subsample': 0.7824642280614534, 'colsample_bytree': 0.9523118085348875, 'max_depth': 12, 'min_child_weight': 12, 'learning_rate': 0.18401340812168082, 'gamma': 0.6189156159434659, 'grow_policy': 'lossguide', 'max_delta_step': 7.25668056648714, 'scale_pos_weight': 11.949684322326544}. Best is trial 98 with value: 0.9728386524147771.[0m
[32m[I 2022-03-30 09:56:06,145][0m Trial 115 finished with value: 0.9714309658273267 and parameters: {'reg_alpha': 9.57710460228706, 'reg_lambda': 0.6396936350874394, 'subsample': 0.48091107508587766, 'colsample_bytree': 0.9391798979503262, 'max_depth': 13, 'min_child_weight': 15, 'learning_rate': 0.12945952931203641, 'gamma': 1.4357096420896491, 'grow_policy': 'lossguide', 'max_delta_step': 7.108272868575858, 'scale_pos_weight': 13.634477369227556}. Best is trial 98 with value: 0.9728386524147771.[0m
[32m[I 2022-03-30 10:00:08,576][0m Trial 116 finished with value: 0.9711921804393909 and parameters: {'reg_alpha': 5.07275973212686, 'reg_lambda': 9.611202809494095, 'subsample': 0.8159169788614659, 'colsample_bytree': 0.9051907079084737, 'max_depth': 15, 'min_child_weight': 59, 'learning_rate': 0.1392853816288534, 'gamma': 0.6254748500313112, 'grow_policy': 'lossguide', 'max_delta_step': 6.549162372607444, 'scale_pos_weight': 14.94022839962029}. Best is trial 98 with value: 0.9728386524147771.[0m
[32m[I 2022-03-30 10:05:20,128][0m Trial 117 finished with value: 0.9713973242640096 and parameters: {'reg_alpha': 9.468273450437271, 'reg_lambda': 9.029009693435246, 'subsample': 0.6378255937419386, 'colsample_bytree': 0.9124893144850409, 'max_depth': 15, 'min_child_weight': 41, 'learning_rate': 0.04862884720431454, 'gamma': 0.8732475602090508, 'grow_policy': 'lossguide', 'max_delta_step': 6.041450917707926, 'scale_pos_weight': 17.18178363142955}. Best is trial 98 with value: 0.9728386524147771.[0m
[32m[I 2022-03-30 10:13:13,020][0m Trial 118 finished with value: 0.971057713172348 and parameters: {'reg_alpha': 6.140614645527575, 'reg_lambda': 8.195887146773394, 'subsample': 0.9231169305437825, 'colsample_bytree': 0.9617132579808648, 'max_depth': 14, 'min_child_weight': 24, 'learning_rate': 0.01923050392378474, 'gamma': 0.21340991167978582, 'grow_policy': 'lossguide', 'max_delta_step': 5.002761663388619, 'scale_pos_weight': 19.364805071377745}. Best is trial 98 with value: 0.9728386524147771.[0m
[32m[I 2022-03-30 10:20:09,153][0m Trial 119 finished with value: 0.9724235738204904 and parameters: {'reg_alpha': 7.69316919392695, 'reg_lambda': 5.800119042785761, 'subsample': 0.8555424845609688, 'colsample_bytree': 0.9563728990825631, 'max_depth': 13, 'min_child_weight': 3, 'learning_rate': 0.10025547823974973, 'gamma': 1.2841766753347854, 'grow_policy': 'lossguide', 'max_delta_step': 6.714802811039978, 'scale_pos_weight': 8.273711193380464}. Best is trial 98 with value: 0.9728386524147771.[0m
[32m[I 2022-03-30 10:23:42,744][0m Trial 120 finished with value: 0.9716862678553353 and parameters: {'reg_alpha': 9.717658105232776, 'reg_lambda': 5.178657819279016, 'subsample': 0.93418527723493, 'colsample_bytree': 0.8923971700095163, 'max_depth': 14, 'min_child_weight': 11, 'learning_rate': 0.18539027598520924, 'gamma': 0.39366129778191855, 'grow_policy': 'lossguide', 'max_delta_step': 4.241868962637927, 'scale_pos_weight': 7.353049628753553}. Best is trial 98 with value: 0.9728386524147771.[0m
[32m[I 2022-03-30 10:28:21,346][0m Trial 121 finished with value: 0.9710428238012758 and parameters: {'reg_alpha': 8.642585834637625, 'reg_lambda': 9.53676567767495, 'subsample': 0.7679140942035974, 'colsample_bytree': 0.9365065040059061, 'max_depth': 9, 'min_child_weight': 19, 'learning_rate': 0.20161876311849564, 'gamma': 2.82155847108433, 'grow_policy': 'depthwise', 'max_delta_step': 8.999673472946956, 'scale_pos_weight': 19.653327924553636}. Best is trial 98 with value: 0.9728386524147771.[0m
[32m[I 2022-03-30 10:32:53,910][0m Trial 122 finished with value: 0.9726831795502174 and parameters: {'reg_alpha': 8.586312869009328, 'reg_lambda': 9.917231050293614, 'subsample': 0.7148784354306595, 'colsample_bytree': 0.8375100627452273, 'max_depth': 11, 'min_child_weight': 7, 'learning_rate': 0.05821468846715532, 'gamma': 1.2198879881177924, 'grow_policy': 'lossguide', 'max_delta_step': 9.684561908846337, 'scale_pos_weight': 12.596754385511378}. Best is trial 98 with value: 0.9728386524147771.[0m
[32m[I 2022-03-30 10:38:39,616][0m Trial 123 finished with value: 0.9724326865735344 and parameters: {'reg_alpha': 5.60674126652758, 'reg_lambda': 8.93296806368079, 'subsample': 0.8863161103590732, 'colsample_bytree': 0.9424141093066434, 'max_depth': 8, 'min_child_weight': 6, 'learning_rate': 0.050283310301150685, 'gamma': 1.5374886978361413, 'grow_policy': 'lossguide', 'max_delta_step': 7.629455434960163, 'scale_pos_weight': 11.671473869998925}. Best is trial 98 with value: 0.9728386524147771.[0m
[32m[I 2022-03-30 10:44:40,500][0m Trial 124 finished with value: 0.9722352240817438 and parameters: {'reg_alpha': 7.219608822963856, 'reg_lambda': 7.247927859067062, 'subsample': 0.7319986149768452, 'colsample_bytree': 0.9619530010419971, 'max_depth': 10, 'min_child_weight': 7, 'learning_rate': 0.03502133167004287, 'gamma': 1.174839626078146, 'grow_policy': 'lossguide', 'max_delta_step': 5.877272096005295, 'scale_pos_weight': 6.254300554459906}. Best is trial 98 with value: 0.9728386524147771.[0m
[32m[I 2022-03-30 10:49:49,914][0m Trial 125 finished with value: 0.9558403382604562 and parameters: {'reg_alpha': 9.168898767400979, 'reg_lambda': 9.655530868573457, 'subsample': 0.502957567460864, 'colsample_bytree': 0.8989289250660661, 'max_depth': 12, 'min_child_weight': 19, 'learning_rate': 0.0035275810988831466, 'gamma': 2.844715134630728, 'grow_policy': 'lossguide', 'max_delta_step': 9.387044103370698, 'scale_pos_weight': 9.210708836888191}. Best is trial 98 with value: 0.9728386524147771.[0m
[32m[I 2022-03-30 10:53:42,957][0m Trial 126 finished with value: 0.9702125097434636 and parameters: {'reg_alpha': 4.342575773698599, 'reg_lambda': 8.811325051826772, 'subsample': 0.8986132804240561, 'colsample_bytree': 0.8944493896535798, 'max_depth': 8, 'min_child_weight': 34, 'learning_rate': 0.2561389785493552, 'gamma': 2.376645253636304, 'grow_policy': 'lossguide', 'max_delta_step': 8.095122313497875, 'scale_pos_weight': 12.013699867909649}. Best is trial 98 with value: 0.9728386524147771.[0m
[32m[I 2022-03-30 10:57:21,615][0m Trial 127 finished with value: 0.9701187952321009 and parameters: {'reg_alpha': 4.708015727302383, 'reg_lambda': 6.756079455888932, 'subsample': 0.736484945220675, 'colsample_bytree': 0.8525601128027276, 'max_depth': 7, 'min_child_weight': 3, 'learning_rate': 0.281591736272323, 'gamma': 2.2268127606624755, 'grow_policy': 'depthwise', 'max_delta_step': 6.877761645987857, 'scale_pos_weight': 12.363032240044697}. Best is trial 98 with value: 0.9728386524147771.[0m
[32m[I 2022-03-30 10:59:13,228][0m Trial 128 finished with value: 0.9689414763989044 and parameters: {'reg_alpha': 2.8803073669812784, 'reg_lambda': 2.906127193131276, 'subsample': 0.4874879939856003, 'colsample_bytree': 0.2828130213172015, 'max_depth': 14, 'min_child_weight': 3, 'learning_rate': 0.08477389252064046, 'gamma': 0.12212596009920654, 'grow_policy': 'depthwise', 'max_delta_step': 5.391542160142298, 'scale_pos_weight': 0.3687217671987959}. Best is trial 98 with value: 0.9728386524147771.[0m
