[32m[I 2022-03-30 05:42:40,607][0m Trial 43 finished with value: 0.9680723386676897 and parameters: {'reg_alpha': 0.9327398674261089, 'reg_lambda': 0.8237503411089659, 'subsample': 0.6776637188829949, 'colsample_bytree': 0.7159891027372546, 'max_depth': 9, 'min_child_weight': 13, 'learning_rate': 0.14632459717050753, 'gamma': 1.776480123471611, 'grow_policy': 'depthwise', 'max_delta_step': 6.68529736976101, 'scale_pos_weight': 0.5357304000686653}. Best is trial 12 with value: 0.9721097038757875.[0m
[32m[I 2022-03-30 05:44:38,800][0m Trial 44 finished with value: 0.9595191565436522 and parameters: {'reg_alpha': 5.042776581912018, 'reg_lambda': 1.7960938376551177, 'subsample': 0.8295298604961567, 'colsample_bytree': 0.8915591721406868, 'max_depth': 3, 'min_child_weight': 18, 'learning_rate': 0.061550028596277284, 'gamma': 0.44367600786388406, 'grow_policy': 'lossguide', 'max_delta_step': 4.531426956877217, 'scale_pos_weight': 2.3440065116494306}. Best is trial 12 with value: 0.9721097038757875.[0m
[32m[I 2022-03-30 05:47:56,085][0m Trial 45 finished with value: 0.9652691212572545 and parameters: {'reg_alpha': 5.280061393417127, 'reg_lambda': 7.05135328257496, 'subsample': 0.7025182161577295, 'colsample_bytree': 0.99128549724845, 'max_depth': 7, 'min_child_weight': 32, 'learning_rate': 0.09317263139744122, 'gamma': 2.1041286935796815, 'grow_policy': 'lossguide', 'max_delta_step': 6.683540047183819, 'scale_pos_weight': 0.6520782904721463}. Best is trial 12 with value: 0.9721097038757875.[0m
[32m[I 2022-03-30 05:48:45,446][0m Trial 46 finished with value: 0.9547929477587896 and parameters: {'reg_alpha': 7.303144578407536, 'reg_lambda': 7.553847624355503, 'subsample': 0.5526381897075776, 'colsample_bytree': 0.2848672014832145, 'max_depth': 2, 'min_child_weight': 18, 'learning_rate': 0.18212215494459424, 'gamma': 0.5290588630299081, 'grow_policy': 'lossguide', 'max_delta_step': 5.002657238280852, 'scale_pos_weight': 6.808878318583863}. Best is trial 12 with value: 0.9721097038757875.[0m
[32m[I 2022-03-30 05:51:00,061][0m Trial 47 finished with value: 0.9696105219539112 and parameters: {'reg_alpha': 0.6959758045722089, 'reg_lambda': 1.9794772110819712, 'subsample': 0.443779658877244, 'colsample_bytree': 0.7585899425690179, 'max_depth': 6, 'min_child_weight': 19, 'learning_rate': 0.09952533557489397, 'gamma': 0.04714367847370671, 'grow_policy': 'depthwise', 'max_delta_step': 5.90602075003026, 'scale_pos_weight': 5.379854923071979}. Best is trial 12 with value: 0.9721097038757875.[0m
[32m[I 2022-03-30 05:52:35,041][0m Trial 48 finished with value: 0.9685202721795715 and parameters: {'reg_alpha': 5.378177161217558, 'reg_lambda': 4.903059701422048, 'subsample': 0.7529711327652789, 'colsample_bytree': 0.2745252181174349, 'max_depth': 6, 'min_child_weight': 40, 'learning_rate': 0.14594907968754264, 'gamma': 2.337607013682678, 'grow_policy': 'lossguide', 'max_delta_step': 3.330692906703886, 'scale_pos_weight': 7.981044313169184}. Best is trial 12 with value: 0.9721097038757875.[0m
[32m[I 2022-03-30 05:55:20,280][0m Trial 49 finished with value: 0.9703543673972602 and parameters: {'reg_alpha': 1.4396469914072125, 'reg_lambda': 0.9481008849772623, 'subsample': 0.5579950620661552, 'colsample_bytree': 0.6239713801731119, 'max_depth': 9, 'min_child_weight': 11, 'learning_rate': 0.13890502274429473, 'gamma': 0.5026250938800323, 'grow_policy': 'lossguide', 'max_delta_step': 7.4857255833173655, 'scale_pos_weight': 2.2707775314036023}. Best is trial 12 with value: 0.9721097038757875.[0m
[32m[I 2022-03-30 05:57:09,444][0m Trial 50 finished with value: 0.9635203038092303 and parameters: {'reg_alpha': 0.7746381580956434, 'reg_lambda': 2.843239876796827, 'subsample': 0.5297082632471912, 'colsample_bytree': 0.5596878417529999, 'max_depth': 9, 'min_child_weight': 55, 'learning_rate': 0.1456124889158606, 'gamma': 2.4481274886963265, 'grow_policy': 'lossguide', 'max_delta_step': 4.025008602897051, 'scale_pos_weight': 1.1086807758540949}. Best is trial 12 with value: 0.9721097038757875.[0m
[32m[I 2022-03-30 06:00:36,872][0m Trial 51 finished with value: 0.9697159811422558 and parameters: {'reg_alpha': 2.2513877037843235, 'reg_lambda': 2.6872868686931572, 'subsample': 0.5379563817842403, 'colsample_bytree': 0.8055054386749946, 'max_depth': 12, 'min_child_weight': 9, 'learning_rate': 0.19915331520140292, 'gamma': 2.1389612156841076, 'grow_policy': 'depthwise', 'max_delta_step': 4.957779608479631, 'scale_pos_weight': 8.141638071697681}. Best is trial 12 with value: 0.9721097038757875.[0m
[32m[I 2022-03-30 06:04:05,226][0m Trial 52 finished with value: 0.9656943116675957 and parameters: {'reg_alpha': 0.23959111241666742, 'reg_lambda': 3.861417486304085, 'subsample': 0.7324979393543796, 'colsample_bytree': 0.97584975465477, 'max_depth': 6, 'min_child_weight': 13, 'learning_rate': 0.3664648897128273, 'gamma': 1.9541079590425405, 'grow_policy': 'depthwise', 'max_delta_step': 4.923720850014116, 'scale_pos_weight': 2.765006626598042}. Best is trial 12 with value: 0.9721097038757875.[0m
[32m[I 2022-03-30 06:06:48,890][0m Trial 53 finished with value: 0.9674739150940598 and parameters: {'reg_alpha': 0.6984559813706435, 'reg_lambda': 6.628866330827465, 'subsample': 0.6621764259342873, 'colsample_bytree': 0.6167870359125813, 'max_depth': 8, 'min_child_weight': 10, 'learning_rate': 0.41488226693481534, 'gamma': 1.0950074317976366, 'grow_policy': 'lossguide', 'max_delta_step': 4.011433387689591, 'scale_pos_weight': 8.858056821058618}. Best is trial 12 with value: 0.9721097038757875.[0m
[32m[I 2022-03-30 06:10:49,213][0m Trial 54 finished with value: 0.9726215602278253 and parameters: {'reg_alpha': 1.9800184998932382, 'reg_lambda': 3.7107791190321233, 'subsample': 0.5956228209305734, 'colsample_bytree': 0.5559784177376106, 'max_depth': 11, 'min_child_weight': 4, 'learning_rate': 0.05133696664441903, 'gamma': 1.1165902421911031, 'grow_policy': 'lossguide', 'max_delta_step': 4.796798805110363, 'scale_pos_weight': 9.61233754073488}. Best is trial 54 with value: 0.9726215602278253.[0m
[32m[I 2022-03-30 06:12:43,670][0m Trial 55 finished with value: 0.9705203696321506 and parameters: {'reg_alpha': 4.834736491602401, 'reg_lambda': 3.166200235856339, 'subsample': 0.5386949873823775, 'colsample_bytree': 0.3138850969497069, 'max_depth': 7, 'min_child_weight': 6, 'learning_rate': 0.05390249508163192, 'gamma': 1.4128392910938563, 'grow_policy': 'lossguide', 'max_delta_step': 0.9679082371138099, 'scale_pos_weight': 13.842734344935637}. Best is trial 54 with value: 0.9726215602278253.[0m
[32m[I 2022-03-30 06:15:20,336][0m Trial 56 finished with value: 0.9702888237861514 and parameters: {'reg_alpha': 1.7227704131380435, 'reg_lambda': 2.7504158455711902, 'subsample': 0.4807229813741189, 'colsample_bytree': 0.6749514323700309, 'max_depth': 9, 'min_child_weight': 13, 'learning_rate': 0.15655463977082493, 'gamma': 0.43336519337089163, 'grow_policy': 'lossguide', 'max_delta_step': 3.0472060161794987, 'scale_pos_weight': 10.152556553748262}. Best is trial 54 with value: 0.9726215602278253.[0m
[32m[I 2022-03-30 06:18:51,809][0m Trial 57 finished with value: 0.9678211439220968 and parameters: {'reg_alpha': 3.761656496335067, 'reg_lambda': 6.598758701030004, 'subsample': 0.8137572603104031, 'colsample_bytree': 0.8392302554396041, 'max_depth': 11, 'min_child_weight': 15, 'learning_rate': 0.4563785628103879, 'gamma': 1.7826688765968706, 'grow_policy': 'lossguide', 'max_delta_step': 7.084823089363456, 'scale_pos_weight': 5.457785021638212}. Best is trial 54 with value: 0.9726215602278253.[0m
[32m[I 2022-03-30 06:22:09,886][0m Trial 58 finished with value: 0.9716690812127414 and parameters: {'reg_alpha': 3.5906143040298346, 'reg_lambda': 3.911630997395746, 'subsample': 0.6352438930477434, 'colsample_bytree': 0.613090355520459, 'max_depth': 14, 'min_child_weight': 16, 'learning_rate': 0.10773174223777525, 'gamma': 0.8005525382294347, 'grow_policy': 'lossguide', 'max_delta_step': 5.563600197508137, 'scale_pos_weight': 6.7072871054479215}. Best is trial 54 with value: 0.9726215602278253.[0m
[32m[I 2022-03-30 06:24:17,166][0m Trial 59 finished with value: 0.9668928274745463 and parameters: {'reg_alpha': 1.209539611360273, 'reg_lambda': 2.8041538687959404, 'subsample': 0.677367193812018, 'colsample_bytree': 0.45739503010188504, 'max_depth': 15, 'min_child_weight': 36, 'learning_rate': 0.29161930358164107, 'gamma': 2.52712166725028, 'grow_policy': 'depthwise', 'max_delta_step': 7.611484208746052, 'scale_pos_weight': 6.901034491445746}. Best is trial 54 with value: 0.9726215602278253.[0m
[32m[I 2022-03-30 06:27:46,785][0m Trial 60 finished with value: 0.9707222473124585 and parameters: {'reg_alpha': 2.2261696914863585, 'reg_lambda': 2.9475363724201675, 'subsample': 0.6356304824458858, 'colsample_bytree': 0.6257998848311784, 'max_depth': 15, 'min_child_weight': 17, 'learning_rate': 0.16872299667848673, 'gamma': 2.85641345494175, 'grow_policy': 'lossguide', 'max_delta_step': 3.999369116666717, 'scale_pos_weight': 9.612043701554759}. Best is trial 54 with value: 0.9726215602278253.[0m
[32m[I 2022-03-30 06:29:29,188][0m Trial 61 finished with value: 0.9695658589817181 and parameters: {'reg_alpha': 2.5738222989752346, 'reg_lambda': 5.967915806898351, 'subsample': 0.45753583266930575, 'colsample_bytree': 0.35923571503090457, 'max_depth': 15, 'min_child_weight': 24, 'learning_rate': 0.12329774937112023, 'gamma': 1.7394652452037138, 'grow_policy': 'lossguide', 'max_delta_step': 9.043472861410791, 'scale_pos_weight': 10.215750737594616}. Best is trial 54 with value: 0.9726215602278253.[0m
[32m[I 2022-03-30 06:31:23,234][0m Trial 62 finished with value: 0.9693044728056447 and parameters: {'reg_alpha': 3.7656448467793187, 'reg_lambda': 1.3431112182324636, 'subsample': 0.8474882712855675, 'colsample_bytree': 0.4085185907532175, 'max_depth': 13, 'min_child_weight': 48, 'learning_rate': 0.13959358709076844, 'gamma': 0.4194685513435632, 'grow_policy': 'lossguide', 'max_delta_step': 3.588922595977701, 'scale_pos_weight': 3.130660188087643}. Best is trial 54 with value: 0.9726215602278253.[0m
[32m[I 2022-03-30 06:34:26,054][0m Trial 63 finished with value: 0.9712864034926635 and parameters: {'reg_alpha': 5.461806331898937, 'reg_lambda': 4.674735246581951, 'subsample': 0.6689169068649827, 'colsample_bytree': 0.7276071316925561, 'max_depth': 14, 'min_child_weight': 7, 'learning_rate': 0.2668825641882906, 'gamma': 0.2648148218003237, 'grow_policy': 'lossguide', 'max_delta_step': 1.2009932383929947, 'scale_pos_weight': 4.34458372901584}. Best is trial 54 with value: 0.9726215602278253.[0m
[32m[I 2022-03-30 06:37:23,998][0m Trial 64 finished with value: 0.9690128408324497 and parameters: {'reg_alpha': 6.778455620968818, 'reg_lambda': 6.3148711127437585, 'subsample': 0.49335742614390027, 'colsample_bytree': 0.5724212982130206, 'max_depth': 15, 'min_child_weight': 3, 'learning_rate': 0.31321279992820783, 'gamma': 0.46310633717218497, 'grow_policy': 'lossguide', 'max_delta_step': 1.4445463807128296, 'scale_pos_weight': 7.297347756650368}. Best is trial 54 with value: 0.9726215602278253.[0m
[32m[I 2022-03-30 06:41:08,875][0m Trial 65 finished with value: 0.9696114933889438 and parameters: {'reg_alpha': 8.009656672080743, 'reg_lambda': 3.8840724639528488, 'subsample': 0.7557879711506503, 'colsample_bytree': 0.7077039004124303, 'max_depth': 11, 'min_child_weight': 5, 'learning_rate': 0.2412994675151266, 'gamma': 1.3559356213674247, 'grow_policy': 'lossguide', 'max_delta_step': 1.3029969146422054, 'scale_pos_weight': 1.6910216825512125}. Best is trial 54 with value: 0.9726215602278253.[0m
[32m[I 2022-03-30 06:45:36,416][0m Trial 66 finished with value: 0.9722729277372405 and parameters: {'reg_alpha': 3.562396521741003, 'reg_lambda': 3.513158774691492, 'subsample': 0.7991426626532299, 'colsample_bytree': 0.4770797640172175, 'max_depth': 14, 'min_child_weight': 7, 'learning_rate': 0.034945381523903696, 'gamma': 1.8811836156617139, 'grow_policy': 'lossguide', 'max_delta_step': 7.5113476226101445, 'scale_pos_weight': 5.105719590979486}. Best is trial 54 with value: 0.9726215602278253.[0m
[32m[I 2022-03-30 06:49:59,243][0m Trial 67 finished with value: 0.9727260951053012 and parameters: {'reg_alpha': 4.0525243945675316, 'reg_lambda': 3.3926279238250703, 'subsample': 0.6795532446730908, 'colsample_bytree': 0.6604654918725615, 'max_depth': 11, 'min_child_weight': 4, 'learning_rate': 0.03591236525702572, 'gamma': 0.2998930171324178, 'grow_policy': 'depthwise', 'max_delta_step': 4.720835262443072, 'scale_pos_weight': 3.7386466185211034}. Best is trial 67 with value: 0.9727260951053012.[0m
[32m[I 2022-03-30 06:52:09,594][0m Trial 68 finished with value: 0.9685614685931694 and parameters: {'reg_alpha': 6.133160607289211, 'reg_lambda': 2.060576023251107, 'subsample': 0.8100325367064937, 'colsample_bytree': 0.47855586172965336, 'max_depth': 7, 'min_child_weight': 18, 'learning_rate': 0.37427388800301187, 'gamma': 0.36840817047934304, 'grow_policy': 'depthwise', 'max_delta_step': 4.971429656877938, 'scale_pos_weight': 5.819713584680116}. Best is trial 67 with value: 0.9727260951053012.[0m
[32m[I 2022-03-30 06:55:14,672][0m Trial 69 finished with value: 0.9713293979422737 and parameters: {'reg_alpha': 0.35796287487990286, 'reg_lambda': 4.180471905885764, 'subsample': 0.9332283127709722, 'colsample_bytree': 0.43246892934354897, 'max_depth': 12, 'min_child_weight': 6, 'learning_rate': 0.14614887397634918, 'gamma': 2.058557511688738, 'grow_policy': 'lossguide', 'max_delta_step': 8.422723533735422, 'scale_pos_weight': 9.880285491434652}. Best is trial 67 with value: 0.9727260951053012.[0m
[32m[I 2022-03-30 06:58:08,199][0m Trial 70 finished with value: 0.9662604913380924 and parameters: {'reg_alpha': 2.283837557474537, 'reg_lambda': 4.303794354038137, 'subsample': 0.8958919302331511, 'colsample_bytree': 0.37277459439968974, 'max_depth': 14, 'min_child_weight': 18, 'learning_rate': 0.009677377714181645, 'gamma': 1.7796519149096413, 'grow_policy': 'lossguide', 'max_delta_step': 6.889974324836103, 'scale_pos_weight': 1.7519408154077714}. Best is trial 67 with value: 0.9727260951053012.[0m
[32m[I 2022-03-30 07:01:11,559][0m Trial 71 finished with value: 0.970769760702177 and parameters: {'reg_alpha': 5.001941309983154, 'reg_lambda': 2.4461066921834522, 'subsample': 0.5047248464888237, 'colsample_bytree': 0.48372769827899087, 'max_depth': 10, 'min_child_weight': 10, 'learning_rate': 0.04302831188344304, 'gamma': 2.177108939539167, 'grow_policy': 'lossguide', 'max_delta_step': 3.9225158852006574, 'scale_pos_weight': 2.645743887618959}. Best is trial 67 with value: 0.9727260951053012.[0m
[32m[I 2022-03-30 07:06:14,911][0m Trial 72 finished with value: 0.9709159470368869 and parameters: {'reg_alpha': 5.441440840751049, 'reg_lambda': 4.150971208134852, 'subsample': 0.7731366132826292, 'colsample_bytree': 0.6253809044960102, 'max_depth': 11, 'min_child_weight': 3, 'learning_rate': 0.015886064236558393, 'gamma': 0.34978063987047003, 'grow_policy': 'depthwise', 'max_delta_step': 4.969358638579633, 'scale_pos_weight': 4.805810974443715}. Best is trial 67 with value: 0.9727260951053012.[0m
[32m[I 2022-03-30 07:09:43,668][0m Trial 73 finished with value: 0.9707898536381269 and parameters: {'reg_alpha': 4.512701857528941, 'reg_lambda': 4.521219837394083, 'subsample': 0.6303626066848659, 'colsample_bytree': 0.6705746872394758, 'max_depth': 14, 'min_child_weight': 14, 'learning_rate': 0.16137566924909688, 'gamma': 2.275560207371808, 'grow_policy': 'lossguide', 'max_delta_step': 7.2895544223654465, 'scale_pos_weight': 10.490774306193373}. Best is trial 67 with value: 0.9727260951053012.[0m
[32m[I 2022-03-30 07:12:22,539][0m Trial 74 finished with value: 0.9682188549918204 and parameters: {'reg_alpha': 5.130659604449269, 'reg_lambda': 2.1229574449815187, 'subsample': 0.5542918945515518, 'colsample_bytree': 0.7246780124931341, 'max_depth': 10, 'min_child_weight': 10, 'learning_rate': 0.31086923416692963, 'gamma': 0.9049130727965315, 'grow_policy': 'depthwise', 'max_delta_step': 4.452056501014376, 'scale_pos_weight': 2.1826876977920584}. Best is trial 67 with value: 0.9727260951053012.[0m
[32m[I 2022-03-30 07:14:35,041][0m Trial 75 finished with value: 0.9668578082998206 and parameters: {'reg_alpha': 0.006903018450975629, 'reg_lambda': 3.849301900140206, 'subsample': 0.4370964458087807, 'colsample_bytree': 0.62937230348198, 'max_depth': 12, 'min_child_weight': 30, 'learning_rate': 0.11902660420546629, 'gamma': 1.7389084164661255, 'grow_policy': 'depthwise', 'max_delta_step': 4.185185732614995, 'scale_pos_weight': 1.8847091565082805}. Best is trial 67 with value: 0.9727260951053012.[0m
[32m[I 2022-03-30 07:17:32,776][0m Trial 76 finished with value: 0.953303315056341 and parameters: {'reg_alpha': 4.874442241561443, 'reg_lambda': 2.368080971238018, 'subsample': 0.6847673302990375, 'colsample_bytree': 0.5994408542980425, 'max_depth': 12, 'min_child_weight': 7, 'learning_rate': 0.32015299797900787, 'gamma': 4.704221322615667, 'grow_policy': 'lossguide', 'max_delta_step': 7.605600295332061, 'scale_pos_weight': 0.23023892037989668}. Best is trial 67 with value: 0.9727260951053012.[0m
[32m[I 2022-03-30 07:20:39,629][0m Trial 77 finished with value: 0.9706485424536928 and parameters: {'reg_alpha': 3.954803329364829, 'reg_lambda': 4.182004446156746, 'subsample': 0.609955822443744, 'colsample_bytree': 0.520964477519045, 'max_depth': 15, 'min_child_weight': 31, 'learning_rate': 0.09547947623146558, 'gamma': 2.9797213667168663, 'grow_policy': 'lossguide', 'max_delta_step': 5.830610924851251, 'scale_pos_weight': 6.720232393392138}. Best is trial 67 with value: 0.9727260951053012.[0m
[32m[I 2022-03-30 07:25:45,102][0m Trial 78 finished with value: 0.9723136519553511 and parameters: {'reg_alpha': 7.114651600256438, 'reg_lambda': 2.435189915767598, 'subsample': 0.9858039463702218, 'colsample_bytree': 0.7304256121238215, 'max_depth': 10, 'min_child_weight': 2, 'learning_rate': 0.046766764280075396, 'gamma': 0.6079544062745827, 'grow_policy': 'lossguide', 'max_delta_step': 7.843189227866055, 'scale_pos_weight': 3.111912567636957}. Best is trial 67 with value: 0.9727260951053012.[0m
[32m[I 2022-03-30 07:31:15,713][0m Trial 79 finished with value: 0.9695714635782985 and parameters: {'reg_alpha': 4.794490199805896, 'reg_lambda': 1.5226431897726347, 'subsample': 0.8628828294367324, 'colsample_bytree': 0.7701374299899302, 'max_depth': 11, 'min_child_weight': 3, 'learning_rate': 0.012191325737968231, 'gamma': 1.5986260227732412, 'grow_policy': 'lossguide', 'max_delta_step': 6.145408064798118, 'scale_pos_weight': 4.925049698904822}. Best is trial 67 with value: 0.9727260951053012.[0m
[32m[I 2022-03-30 07:36:05,458][0m Trial 80 finished with value: 0.9723662220049437 and parameters: {'reg_alpha': 8.552924022095228, 'reg_lambda': 5.191170636221003, 'subsample': 0.9423912772069316, 'colsample_bytree': 0.9507027221039088, 'max_depth': 12, 'min_child_weight': 12, 'learning_rate': 0.1341812480733236, 'gamma': 0.07590862869437864, 'grow_policy': 'lossguide', 'max_delta_step': 6.6123150406184505, 'scale_pos_weight': 6.316792239992898}. Best is trial 67 with value: 0.9727260951053012.[0m
[32m[I 2022-03-30 07:36:40,499][0m Trial 81 finished with value: 0.792548867446505 and parameters: {'reg_alpha': 0.27662465266774694, 'reg_lambda': 5.775299261108305, 'subsample': 0.7143258534176044, 'colsample_bytree': 0.854684995742746, 'max_depth': 11, 'min_child_weight': 26, 'learning_rate': 0.16889465091545414, 'gamma': 1.07655884243675, 'grow_policy': 'lossguide', 'max_delta_step': 6.256661755987844, 'scale_pos_weight': 0.0070129349656244955}. Best is trial 67 with value: 0.9727260951053012.[0m
[32m[I 2022-03-30 07:41:05,053][0m Trial 82 finished with value: 0.9705798832747566 and parameters: {'reg_alpha': 9.746591927044626, 'reg_lambda': 3.0588202798975335, 'subsample': 0.8645652438021991, 'colsample_bytree': 0.92993927037578, 'max_depth': 9, 'min_child_weight': 11, 'learning_rate': 0.3137693589461076, 'gamma': 1.2116928584648126, 'grow_policy': 'lossguide', 'max_delta_step': 3.607400910877852, 'scale_pos_weight': 10.01925894618633}. Best is trial 67 with value: 0.9727260951053012.[0m
[32m[I 2022-03-30 07:46:06,683][0m Trial 83 finished with value: 0.971196957590041 and parameters: {'reg_alpha': 6.440046247165695, 'reg_lambda': 3.1927161346084465, 'subsample': 0.8878838778165128, 'colsample_bytree': 0.9668542576952597, 'max_depth': 15, 'min_child_weight': 21, 'learning_rate': 0.19936259016411967, 'gamma': 1.7628453812660019, 'grow_policy': 'lossguide', 'max_delta_step': 4.095004512189671, 'scale_pos_weight': 8.49987797929035}. Best is trial 67 with value: 0.9727260951053012.[0m
[32m[I 2022-03-30 07:50:34,545][0m Trial 84 finished with value: 0.9717110105968009 and parameters: {'reg_alpha': 6.9838578560288385, 'reg_lambda': 3.4710531788009287, 'subsample': 0.9468828857917441, 'colsample_bytree': 0.7508087696709035, 'max_depth': 9, 'min_child_weight': 3, 'learning_rate': 0.13886982132291248, 'gamma': 1.416500260980981, 'grow_policy': 'lossguide', 'max_delta_step': 9.976508851010776, 'scale_pos_weight': 5.948870503964373}. Best is trial 67 with value: 0.9727260951053012.[0m
[32m[I 2022-03-30 07:54:49,350][0m Trial 85 finished with value: 0.968681646374204 and parameters: {'reg_alpha': 8.625018516215453, 'reg_lambda': 7.734400295787005, 'subsample': 0.8731887229043153, 'colsample_bytree': 0.9824496165338772, 'max_depth': 12, 'min_child_weight': 10, 'learning_rate': 0.30328633050440784, 'gamma': 0.8937587653052549, 'grow_policy': 'lossguide', 'max_delta_step': 6.115843921857956, 'scale_pos_weight': 0.8976161920947296}. Best is trial 67 with value: 0.9727260951053012.[0m
